{
  "provider": "openai",
  "model": "gpt-5.6-terra",
  "purpose": "manga_direction",
  "prompt_version": "manga-direction.v1",
  "skill_hashes": ["1111111111111111111111111111111111111111111111111111111111111111"],
  "input_artifact_ids": ["artifact_context_001"],
  "input_tokens": 4200,
  "output_tokens": 1600,
  "cost_usd": 0.42,
  "latency_ms": 8210,
  "attempt": 1,
  "created_at": "2026-07-19T10:02:00Z"
}
